{
  "$schema": "https://json-schema.org/draft/2020-12/schema",
  "type": "object",
  "properties": {
    "mealJourney": {
      "type": "string",
      "enum": ["now", "week"]
    },
    "nutritionConfidence": {
      "type": "string",
      "enum": ["high", "medium", "low", "unavailable"]
    },
    "nutritionProvenance": {
      "type": "object",
      "properties": {
        "usdaFdcIds": {
          "minItems": 1,
          "type": "array",
          "items": {
            "type": "integer",
            "exclusiveMinimum": 0,
            "maximum": 9007199254740991
          },
          "uniqueItems": true
        },
        "cacheChecksum": {
          "type": "string",
          "pattern": "^[a-f0-9]{64}$"
        },
        "matchMethod": {
          "type": "string",
          "enum": ["exact", "alias"]
        },
        "sourceVersion": {
          "type": "string",
          "minLength": 1
        },
        "calculatedAt": {
          "type": "string",
          "allOf": [
            {
              "pattern": "^(?:(?:\\d\\d[2468][048]|\\d\\d[13579][26]|\\d\\d0[48]|[02468][048]00|[13579][26]00)-02-29|\\d{4}-(?:(?:0[13578]|1[02])-(?:0[1-9]|[12]\\d|3[01])|(?:0[469]|11)-(?:0[1-9]|[12]\\d|30)|(?:02)-(?:0[1-9]|1\\d|2[0-8])))T(?:(?:[01]\\d|2[0-3]):[0-5]\\d(?::[0-5]\\d(?:\\.\\d+)?)?(?:Z|([+-](?:[01]\\d|2[0-3]):[0-5]\\d)))$"
            },
            {
              "pattern": "^\\d{4}-\\d{2}-\\d{2}T\\d{2}:\\d{2}:\\d{2}(?:\\.\\d+)?[+-]\\d{2}:\\d{2}$"
            }
          ]
        },
        "confidence": {
          "type": "number",
          "minimum": 0,
          "maximum": 1
        }
      },
      "required": [
        "usdaFdcIds",
        "cacheChecksum",
        "matchMethod",
        "sourceVersion",
        "calculatedAt",
        "confidence"
      ],
      "additionalProperties": false
    },
    "bodyProfile": {
      "type": "object",
      "properties": {
        "ageYears": {
          "type": "integer",
          "minimum": 18,
          "maximum": 120
        },
        "heightCentimeters": {
          "type": "number",
          "minimum": 120,
          "maximum": 230
        },
        "weightKilograms": {
          "type": "number",
          "minimum": 35,
          "maximum": 300
        },
        "calculationSex": {
          "type": "string",
          "enum": ["female", "male"]
        },
        "activityLevel": {
          "type": "string",
          "enum": ["sedentary", "light", "moderate", "active", "very_active"]
        },
        "goal": {
          "type": "string",
          "enum": ["lose", "maintain", "gain"]
        },
        "pregnant": {
          "type": "boolean"
        },
        "breastfeeding": {
          "type": "boolean"
        }
      },
      "required": [
        "ageYears",
        "heightCentimeters",
        "weightKilograms",
        "calculationSex",
        "activityLevel",
        "goal",
        "pregnant",
        "breastfeeding"
      ],
      "additionalProperties": false
    },
    "tasteSignal": {
      "type": "object",
      "properties": {
        "kind": {
          "type": "string",
          "const": "photo_selected"
        },
        "recipeId": {
          "type": "string",
          "minLength": 1
        },
        "journey": {
          "type": "string",
          "enum": ["now", "week"]
        },
        "recordedAt": {
          "type": "string",
          "format": "date-time",
          "pattern": "^(?:(?:\\d\\d[2468][048]|\\d\\d[13579][26]|\\d\\d0[48]|[02468][048]00|[13579][26]00)-02-29|\\d{4}-(?:(?:0[13578]|1[02])-(?:0[1-9]|[12]\\d|3[01])|(?:0[469]|11)-(?:0[1-9]|[12]\\d|30)|(?:02)-(?:0[1-9]|1\\d|2[0-8])))T(?:(?:[01]\\d|2[0-3]):[0-5]\\d(?::[0-5]\\d(?:\\.\\d+)?)?(?:Z|([+-](?:[01]\\d|2[0-3]):[0-5]\\d)))$"
        }
      },
      "required": ["kind", "recipeId", "journey", "recordedAt"],
      "additionalProperties": false
    },
    "mealSatietyInput": {
      "type": "object",
      "properties": {
        "recipeId": {
          "type": "string",
          "minLength": 1
        },
        "level": {
          "type": "string",
          "enum": ["still_hungry", "satisfied", "too_full"]
        }
      },
      "required": ["recipeId", "level"],
      "additionalProperties": false
    },
    "mealSatietyRecord": {
      "type": "object",
      "properties": {
        "id": {
          "type": "string",
          "format": "uuid",
          "pattern": "^([0-9a-fA-F]{8}-[0-9a-fA-F]{4}-[1-8][0-9a-fA-F]{3}-[89abAB][0-9a-fA-F]{3}-[0-9a-fA-F]{12}|00000000-0000-0000-0000-000000000000|ffffffff-ffff-ffff-ffff-ffffffffffff)$"
        },
        "userId": {
          "type": "string",
          "format": "uuid",
          "pattern": "^([0-9a-fA-F]{8}-[0-9a-fA-F]{4}-[1-8][0-9a-fA-F]{3}-[89abAB][0-9a-fA-F]{3}-[0-9a-fA-F]{12}|00000000-0000-0000-0000-000000000000|ffffffff-ffff-ffff-ffff-ffffffffffff)$"
        },
        "recordedAt": {
          "type": "string",
          "format": "date-time",
          "pattern": "^(?:(?:\\d\\d[2468][048]|\\d\\d[13579][26]|\\d\\d0[48]|[02468][048]00|[13579][26]00)-02-29|\\d{4}-(?:(?:0[13578]|1[02])-(?:0[1-9]|[12]\\d|3[01])|(?:0[469]|11)-(?:0[1-9]|[12]\\d|30)|(?:02)-(?:0[1-9]|1\\d|2[0-8])))T(?:(?:[01]\\d|2[0-3]):[0-5]\\d(?::[0-5]\\d(?:\\.\\d+)?)?(?:Z|([+-](?:[01]\\d|2[0-3]):[0-5]\\d)))$"
        },
        "recipeId": {
          "type": "string",
          "minLength": 1
        },
        "level": {
          "type": "string",
          "enum": ["still_hungry", "satisfied", "too_full"]
        }
      },
      "required": ["id", "userId", "recordedAt", "recipeId", "level"],
      "additionalProperties": false
    },
    "onboardingProgress": {
      "type": "object",
      "properties": {
        "safetyCompleted": {
          "type": "boolean"
        },
        "weekPreferenceCompleted": {
          "type": "boolean"
        },
        "photoTasteCompleted": {
          "type": "boolean"
        },
        "bodyProfileCompleted": {
          "type": "boolean"
        },
        "reminderCompleted": {
          "type": "boolean"
        },
        "updatedAt": {
          "type": "string",
          "format": "date-time",
          "pattern": "^(?:(?:\\d\\d[2468][048]|\\d\\d[13579][26]|\\d\\d0[48]|[02468][048]00|[13579][26]00)-02-29|\\d{4}-(?:(?:0[13578]|1[02])-(?:0[1-9]|[12]\\d|3[01])|(?:0[469]|11)-(?:0[1-9]|[12]\\d|30)|(?:02)-(?:0[1-9]|1\\d|2[0-8])))T(?:(?:[01]\\d|2[0-3]):[0-5]\\d(?::[0-5]\\d(?:\\.\\d+)?)?(?:Z|([+-](?:[01]\\d|2[0-3]):[0-5]\\d)))$"
        }
      },
      "required": [
        "safetyCompleted",
        "weekPreferenceCompleted",
        "photoTasteCompleted",
        "bodyProfileCompleted",
        "reminderCompleted",
        "updatedAt"
      ],
      "additionalProperties": false
    },
    "onboardingPromptState": {
      "type": "object",
      "properties": {
        "shownThisSession": {
          "type": "boolean"
        },
        "activePrompt": {
          "anyOf": [
            {
              "type": "string",
              "enum": ["safety", "week_preference", "photo_taste", "body_profile", "reminder"]
            },
            {
              "type": "null"
            }
          ]
        }
      },
      "required": ["shownThisSession", "activePrompt"],
      "additionalProperties": false
    },
    "reminderPreferences": {
      "type": "object",
      "properties": {
        "enabled": {
          "type": "boolean"
        },
        "leadMinutes": {
          "anyOf": [
            {
              "type": "number",
              "const": 0
            },
            {
              "type": "number",
              "const": 10
            },
            {
              "type": "number",
              "const": 15
            },
            {
              "type": "number",
              "const": 30
            },
            {
              "type": "number",
              "const": 60
            }
          ]
        },
        "updatedAt": {
          "type": "string",
          "format": "date-time",
          "pattern": "^(?:(?:\\d\\d[2468][048]|\\d\\d[13579][26]|\\d\\d0[48]|[02468][048]00|[13579][26]00)-02-29|\\d{4}-(?:(?:0[13578]|1[02])-(?:0[1-9]|[12]\\d|3[01])|(?:0[469]|11)-(?:0[1-9]|[12]\\d|30)|(?:02)-(?:0[1-9]|1\\d|2[0-8])))T(?:(?:[01]\\d|2[0-3]):[0-5]\\d(?::[0-5]\\d(?:\\.\\d+)?)?(?:Z|([+-](?:[01]\\d|2[0-3]):[0-5]\\d)))$"
        }
      },
      "required": ["enabled", "leadMinutes", "updatedAt"],
      "additionalProperties": false
    },
    "weeklyMealPlan": {
      "type": "object",
      "properties": {
        "weekStart": {
          "type": "string",
          "format": "date",
          "pattern": "^(?:(?:\\d\\d[2468][048]|\\d\\d[13579][26]|\\d\\d0[48]|[02468][048]00|[13579][26]00)-02-29|\\d{4}-(?:(?:0[13578]|1[02])-(?:0[1-9]|[12]\\d|3[01])|(?:0[469]|11)-(?:0[1-9]|[12]\\d|30)|(?:02)-(?:0[1-9]|1\\d|2[0-8])))$"
        },
        "dayCount": {
          "anyOf": [
            {
              "type": "number",
              "const": 3
            },
            {
              "type": "number",
              "const": 5
            },
            {
              "type": "number",
              "const": 7
            }
          ]
        },
        "mealSlots": {
          "minItems": 1,
          "maxItems": 3,
          "type": "array",
          "items": {
            "type": "string",
            "enum": ["breakfast", "lunch", "dinner"]
          }
        },
        "limitedVariety": {
          "type": "boolean"
        },
        "entries": {
          "minItems": 3,
          "maxItems": 21,
          "type": "array",
          "items": {
            "anyOf": [
              {
                "type": "object",
                "properties": {
                  "kind": {
                    "type": "string",
                    "const": "recipe"
                  },
                  "date": {
                    "type": "string",
                    "format": "date",
                    "pattern": "^(?:(?:\\d\\d[2468][048]|\\d\\d[13579][26]|\\d\\d0[48]|[02468][048]00|[13579][26]00)-02-29|\\d{4}-(?:(?:0[13578]|1[02])-(?:0[1-9]|[12]\\d|3[01])|(?:0[469]|11)-(?:0[1-9]|[12]\\d|30)|(?:02)-(?:0[1-9]|1\\d|2[0-8])))$"
                  },
                  "mealSlot": {
                    "type": "string",
                    "enum": ["breakfast", "lunch", "dinner"]
                  },
                  "recipeId": {
                    "type": "string",
                    "minLength": 1
                  },
                  "plannedMealTime": {
                    "type": "string",
                    "allOf": [
                      {
                        "pattern": "^(?:(?:\\d\\d[2468][048]|\\d\\d[13579][26]|\\d\\d0[48]|[02468][048]00|[13579][26]00)-02-29|\\d{4}-(?:(?:0[13578]|1[02])-(?:0[1-9]|[12]\\d|3[01])|(?:0[469]|11)-(?:0[1-9]|[12]\\d|30)|(?:02)-(?:0[1-9]|1\\d|2[0-8])))T(?:(?:[01]\\d|2[0-3]):[0-5]\\d(?::[0-5]\\d(?:\\.\\d+)?)?(?:Z|([+-](?:[01]\\d|2[0-3]):[0-5]\\d)))$"
                      },
                      {
                        "pattern": "^\\d{4}-\\d{2}-\\d{2}T\\d{2}:\\d{2}:\\d{2}(?:\\.\\d+)?[+-]\\d{2}:\\d{2}$"
                      }
                    ]
                  },
                  "statedRelaxations": {
                    "type": "array",
                    "items": {
                      "type": "string",
                      "enum": ["time", "cuisine"]
                    }
                  },
                  "portionGuidance": {
                    "anyOf": [
                      {
                        "type": "object",
                        "properties": {
                          "servings": {
                            "type": "number",
                            "minimum": 0.75,
                            "maximum": 1.5,
                            "multipleOf": 0.25
                          },
                          "label": {
                            "type": "string",
                            "pattern": "^Start with .+ servings?$"
                          },
                          "disclaimer": {
                            "type": "string",
                            "const": "Estimate only—adjust to your hunger."
                          }
                        },
                        "required": ["servings", "label", "disclaimer"],
                        "additionalProperties": false
                      },
                      {
                        "type": "null"
                      }
                    ]
                  }
                },
                "required": [
                  "kind",
                  "date",
                  "mealSlot",
                  "recipeId",
                  "plannedMealTime",
                  "statedRelaxations",
                  "portionGuidance"
                ],
                "additionalProperties": false
              },
              {
                "type": "object",
                "properties": {
                  "kind": {
                    "type": "string",
                    "const": "day_of_decision"
                  },
                  "date": {
                    "type": "string",
                    "format": "date",
                    "pattern": "^(?:(?:\\d\\d[2468][048]|\\d\\d[13579][26]|\\d\\d0[48]|[02468][048]00|[13579][26]00)-02-29|\\d{4}-(?:(?:0[13578]|1[02])-(?:0[1-9]|[12]\\d|3[01])|(?:0[469]|11)-(?:0[1-9]|[12]\\d|30)|(?:02)-(?:0[1-9]|1\\d|2[0-8])))$"
                  },
                  "mealSlot": {
                    "type": "string",
                    "enum": ["breakfast", "lunch", "dinner"]
                  },
                  "reason": {
                    "type": "string",
                    "enum": ["no_safe_recipe", "grocery_need_cap", "not_planned"]
                  }
                },
                "required": ["kind", "date", "mealSlot", "reason"],
                "additionalProperties": false
              }
            ]
          }
        },
        "status": {
          "type": "string",
          "enum": ["draft", "confirmed"]
        },
        "groceryNeeds": {
          "maxItems": 12,
          "type": "array",
          "items": {
            "type": "object",
            "properties": {
              "ingredientId": {
                "type": "string",
                "minLength": 1
              },
              "recipeIds": {
                "minItems": 1,
                "type": "array",
                "items": {
                  "type": "string",
                  "minLength": 1
                }
              },
              "dates": {
                "minItems": 1,
                "type": "array",
                "items": {
                  "type": "string",
                  "format": "date",
                  "pattern": "^(?:(?:\\d\\d[2468][048]|\\d\\d[13579][26]|\\d\\d0[48]|[02468][048]00|[13579][26]00)-02-29|\\d{4}-(?:(?:0[13578]|1[02])-(?:0[1-9]|[12]\\d|3[01])|(?:0[469]|11)-(?:0[1-9]|[12]\\d|30)|(?:02)-(?:0[1-9]|1\\d|2[0-8])))$"
                }
              }
            },
            "required": ["ingredientId", "recipeIds", "dates"],
            "additionalProperties": false
          }
        },
        "statedRelaxations": {
          "type": "array",
          "items": {
            "type": "string",
            "enum": ["time", "cuisine"]
          }
        }
      },
      "required": [
        "weekStart",
        "dayCount",
        "mealSlots",
        "limitedVariety",
        "entries",
        "status",
        "groceryNeeds",
        "statedRelaxations"
      ],
      "additionalProperties": false
    }
  },
  "required": [
    "mealJourney",
    "nutritionConfidence",
    "nutritionProvenance",
    "bodyProfile",
    "tasteSignal",
    "mealSatietyInput",
    "mealSatietyRecord",
    "onboardingProgress",
    "onboardingPromptState",
    "reminderPreferences",
    "weeklyMealPlan"
  ],
  "additionalProperties": false,
  "x-homechef-semanticValidation": {
    "version": 2,
    "validator": "homechef.dual-meal-journeys.v2",
    "rules": [
      {
        "id": "prompt_state_lifecycle",
        "kind": "conditional_null",
        "path": "/onboardingPromptState",
        "whenField": "shownThisSession",
        "whenEquals": false,
        "nullField": "activePrompt"
      },
      {
        "id": "planned_time_local_date",
        "kind": "matching_local_date",
        "path": "/weeklyMealPlan/entries",
        "discriminatorField": "kind",
        "discriminatorEquals": "recipe",
        "dateField": "date",
        "timestampField": "plannedMealTime"
      },
      {
        "id": "selected_meal_slot_coverage",
        "kind": "meal_slot_coverage",
        "path": "/weeklyMealPlan",
        "startField": "weekStart",
        "entriesField": "entries",
        "dateField": "date",
        "dayCountField": "dayCount",
        "mealSlotsField": "mealSlots",
        "mealSlotField": "mealSlot"
      },
      {
        "id": "unique_grocery_ingredient_ids",
        "kind": "unique_by",
        "path": "/weeklyMealPlan/groceryNeeds",
        "keyField": "ingredientId"
      },
      {
        "id": "ascending_usda_fdc_ids",
        "kind": "strictly_ascending_numbers",
        "path": "/nutritionProvenance/usdaFdcIds"
      }
    ]
  }
}
