{
  "mealJourney": "week",
  "nutritionConfidence": "medium",
  "nutritionProvenance": {
    "usdaFdcIds": [171287, 173424],
    "cacheChecksum": "aaaaaaaaaaaaaaaaaaaaaaaaaaaaaaaaaaaaaaaaaaaaaaaaaaaaaaaaaaaaaaaa",
    "matchMethod": "alias",
    "sourceVersion": "FoodData Central 2026-08",
    "calculatedAt": "2026-08-22T12:00:00-07:00",
    "confidence": 0.82
  },
  "bodyProfile": {
    "ageYears": 32,
    "heightCentimeters": 168,
    "weightKilograms": 68.5,
    "calculationSex": "female",
    "activityLevel": "moderate",
    "goal": "maintain",
    "pregnant": false,
    "breastfeeding": false
  },
  "tasteSignal": {
    "kind": "photo_selected",
    "recipeId": "taste-only-recipe",
    "journey": "week",
    "recordedAt": "2026-08-23T12:00:00Z"
  },
  "mealSatietyInput": {
    "recipeId": "recipe-1",
    "level": "satisfied"
  },
  "mealSatietyRecord": {
    "id": "6c35893f-df48-4e7c-9914-c2390b51c040",
    "userId": "9659c59f-0a9e-45d6-a040-5b161d28771e",
    "recordedAt": "2026-08-23T12:00:00Z",
    "recipeId": "recipe-1",
    "level": "satisfied"
  },
  "onboardingProgress": {
    "safetyCompleted": true,
    "weekPreferenceCompleted": true,
    "photoTasteCompleted": false,
    "bodyProfileCompleted": true,
    "reminderCompleted": false,
    "updatedAt": "2026-08-23T12:00:00Z"
  },
  "onboardingPromptState": {
    "shownThisSession": true,
    "activePrompt": null
  },
  "reminderPreferences": {
    "enabled": true,
    "leadMinutes": 15,
    "updatedAt": "2026-08-23T12:00:00Z"
  },
  "weeklyMealPlan": {
    "weekStart": "2026-08-24",
    "dayCount": 7,
    "mealSlots": ["dinner"],
    "limitedVariety": false,
    "entries": [
      {
        "kind": "recipe",
        "date": "2026-08-24",
        "mealSlot": "dinner",
        "recipeId": "recipe-1",
        "plannedMealTime": "2026-08-24T18:30:00-07:00",
        "statedRelaxations": [],
        "portionGuidance": {
          "servings": 1.25,
          "label": "Start with 1.25 servings",
          "disclaimer": "Estimate only—adjust to your hunger."
        }
      },
      {
        "kind": "recipe",
        "date": "2026-08-25",
        "mealSlot": "dinner",
        "recipeId": "recipe-2",
        "plannedMealTime": "2026-08-25T18:30:00-07:00",
        "statedRelaxations": [],
        "portionGuidance": null
      },
      {
        "kind": "recipe",
        "date": "2026-08-26",
        "mealSlot": "dinner",
        "recipeId": "recipe-3",
        "plannedMealTime": "2026-08-26T18:30:00-07:00",
        "statedRelaxations": [],
        "portionGuidance": null
      },
      {
        "kind": "recipe",
        "date": "2026-08-27",
        "mealSlot": "dinner",
        "recipeId": "recipe-4",
        "plannedMealTime": "2026-08-27T18:30:00-07:00",
        "statedRelaxations": [],
        "portionGuidance": null
      },
      {
        "kind": "recipe",
        "date": "2026-08-28",
        "mealSlot": "dinner",
        "recipeId": "recipe-5",
        "plannedMealTime": "2026-08-28T18:30:00-07:00",
        "statedRelaxations": [],
        "portionGuidance": null
      },
      {
        "kind": "recipe",
        "date": "2026-08-29",
        "mealSlot": "dinner",
        "recipeId": "recipe-6",
        "plannedMealTime": "2026-08-29T18:30:00-07:00",
        "statedRelaxations": [],
        "portionGuidance": null
      },
      {
        "kind": "recipe",
        "date": "2026-08-30",
        "mealSlot": "dinner",
        "recipeId": "recipe-7",
        "plannedMealTime": "2026-08-30T18:30:00-07:00",
        "statedRelaxations": [],
        "portionGuidance": null
      }
    ],
    "status": "draft",
    "groceryNeeds": [],
    "statedRelaxations": []
  }
}
